[
  {
    "id": "error-rate-increased",
    "version": 1,
    "title": "Error rate increased relative to baseline",
    "requirement": 1,
    "task_type": "investigate",
    "operator_context": "Labelwatch is serving traffic. Determine whether its recent log error rate needs attention and what to inspect next.",
    "operator_task": "Identify the observed change, comparison basis, evidence strength, unknown impact, and safest next inspection.",
    "start_route": "/",
    "fixture": {
      "provenance": "synthetic",
      "seed_id": "ux-error-shift-001",
      "clock": "2026-07-26T07:17:00Z",
      "current_generation": 4200,
      "real_path_coverage": "fixture_only",
      "observation_bases": [
        {
          "id": "logs-current",
          "source": "labelwatch/journal",
          "observed_at": "2026-07-26T07:16:45Z",
          "generation": 4200,
          "tense": "current"
        },
        {
          "id": "logs-baseline",
          "source": "labelwatch/journal",
          "observed_at": "2026-07-26T06:46:45Z",
          "generation": 4170,
          "tense": "historical"
        }
      ],
      "notes": "Two explicit windows; deterministic 3/16 current errors and 40/1000 baseline errors."
    },
    "visible_state": {
      "decision_claims": [
        {
          "id": "error-rate-increased",
          "text": "Labelwatch recent log error rate is 18.8%, above a 4.0% established baseline."
        }
      ],
      "evidence": [
        {
          "id": "current-error-sample",
          "text": "3 errors in 16 recent messages.",
          "basis_id": "logs-current"
        },
        {
          "id": "baseline-error-sample",
          "text": "40 errors in 1000 baseline messages.",
          "basis_id": "logs-baseline"
        }
      ],
      "unknowns": [
        {
          "id": "service-impact",
          "text": "User-visible service impact has not been established."
        },
        {
          "id": "cause",
          "text": "The observations establish change, not its cause."
        }
      ],
      "conflicts": [],
      "actions": [
        {
          "id": "inspect-error-examples",
          "label": "Inspect error examples",
          "available": true,
          "effect": [
            "opens retained examples from the same current observation"
          ],
          "does_not": [
            "change labelwatch or finding state"
          ],
          "reversible": true,
          "precondition": "Current observation remains resolvable.",
          "target": "retained labelwatch error examples for the current observation",
          "state_transition": "No state transition; opens retained evidence.",
          "underlying_system_affected": false,
          "evidence_policy": "retained",
          "detector_observation": "continues",
          "future_observations": "Future detector observations continue normally.",
          "recording": "No finding lifecycle transition is recorded."
        },
        {
          "id": "compare-recent-changes",
          "label": "Compare recent changes",
          "available": true,
          "effect": [
            "opens a time-aligned change inspection"
          ],
          "does_not": [
            "claim a deployment caused the errors"
          ],
          "reversible": true,
          "precondition": "Change metadata is available.",
          "target": "time-aligned deployment and configuration evidence",
          "state_transition": "No state transition; opens a comparison view.",
          "underlying_system_affected": false,
          "evidence_policy": "retained",
          "detector_observation": "continues",
          "future_observations": "Future detector observations continue normally.",
          "recording": "No finding lifecycle transition is recorded."
        }
      ]
    },
    "oracle": {
      "outcome": "investigate",
      "required_subject_ids": [
        "labelwatch"
      ],
      "required_conclusion_ids": [
        "error-rate-increased"
      ],
      "allowed_conclusions": [
        {
          "id": "error-rate-increased",
          "text": "The recent observed error proportion is above baseline."
        },
        {
          "id": "small-current-window",
          "text": "The current window contains only 16 messages."
        }
      ],
      "forbidden_conclusions": [
        {
          "id": "deployment-caused-errors",
          "text": "A deployment caused the increase."
        },
        {
          "id": "outage-proven",
          "text": "The service is in an outage."
        }
      ],
      "required_evidence_ids": [
        "current-error-sample",
        "baseline-error-sample"
      ],
      "required_unknown_ids": [
        "service-impact",
        "cause"
      ],
      "must_notice_stale": false,
      "must_notice_conflict": false,
      "causality": "not_established",
      "safe_action_ids": [
        "inspect-error-examples",
        "compare-recent-changes"
      ],
      "unsafe_action_ids": [
        "close-finding",
        "rollback-deployment"
      ],
      "action_expectation": "Inspect examples or time-aligned changes; do not close, suppress, or roll back from this evidence alone."
    },
    "comparison_eligible": true,
    "variants": [
      "baseline",
      "redesign",
      "text"
    ],
    "tags": [
      "statistical-shift",
      "unknown-impact",
      "vertical-slice"
    ]
  },
  {
    "id": "disk-pressure-conflicting-views",
    "version": 1,
    "title": "Disk pressure with conflicting overview and detail values",
    "requirement": 2,
    "task_type": "refuse",
    "operator_context": "The overview and a disk detail page show materially different utilization for the same host.",
    "operator_task": "Determine which value is current, explain the discrepancy, and decide whether immediate disk action is justified.",
    "start_route": "/finding/disk-pressure/storage-01/root",
    "fixture": {
      "provenance": "synthetic",
      "seed_id": "ux-disk-conflict-002",
      "clock": "2026-07-26T07:17:00Z",
      "current_generation": 4200,
      "real_path_coverage": "fixture_only",
      "observation_bases": [
        {
          "id": "host-current",
          "source": "storage-01/host",
          "observed_at": "2026-07-26T07:16:40Z",
          "generation": 4200,
          "tense": "current"
        },
        {
          "id": "host-old-detail",
          "source": "storage-01/host-history",
          "observed_at": "2026-07-26T06:57:00Z",
          "generation": 4180,
          "tense": "historical"
        }
      ],
      "notes": "Overview is 91% at generation 4200; detail value is 63% and explicitly historical at generation 4180."
    },
    "visible_state": {
      "decision_claims": [
        {
          "id": "current-disk-pressure",
          "text": "The current host observation reports root filesystem use at 91%."
        }
      ],
      "evidence": [
        {
          "id": "overview-disk-91",
          "text": "Overview: 91% used, observed 20 seconds ago.",
          "basis_id": "host-current"
        },
        {
          "id": "detail-disk-63-history",
          "text": "Historical detail: 63% used, observed 20 minutes earlier.",
          "basis_id": "host-old-detail"
        }
      ],
      "unknowns": [
        {
          "id": "growth-cause",
          "text": "The cause of the 28 percentage-point change is not established."
        }
      ],
      "conflicts": [
        {
          "id": "disk-values-different-bases",
          "text": "The two values differ because they come from different observation times and generations."
        }
      ],
      "actions": [
        {
          "id": "inspect-current-disk",
          "label": "Inspect current disk evidence",
          "available": true,
          "effect": [
            "opens filesystems and capacity evidence tied to generation 4200"
          ],
          "does_not": [
            "delete files or change the host"
          ],
          "reversible": true,
          "precondition": "Generation 4200 remains available.",
          "target": "generation 4200 filesystem and capacity evidence",
          "state_transition": "No state transition; opens current disk evidence.",
          "underlying_system_affected": false,
          "evidence_policy": "retained",
          "detector_observation": "continues",
          "future_observations": "Future disk observations continue normally.",
          "recording": "No finding lifecycle transition is recorded."
        },
        {
          "id": "dismiss-using-old-value",
          "label": "Dismiss as 63%",
          "available": false,
          "effect": [
            "would treat a historical value as current"
          ],
          "does_not": [
            "establish current safety"
          ],
          "reversible": false,
          "precondition": "Never valid while the current 91% observation exists.",
          "target": "the current disk-pressure decision",
          "state_transition": "Unavailable; no state transition occurs.",
          "underlying_system_affected": false,
          "evidence_policy": "retained",
          "detector_observation": "continues",
          "future_observations": "Future disk observations continue normally.",
          "recording": "No transition is recorded because the action is unavailable."
        }
      ]
    },
    "oracle": {
      "outcome": "investigate",
      "required_subject_ids": [
        "storage-01/root"
      ],
      "required_conclusion_ids": [
        "current-disk-pressure"
      ],
      "allowed_conclusions": [
        {
          "id": "current-disk-pressure",
          "text": "The current basis reports 91% disk use."
        },
        {
          "id": "historical-value-not-current",
          "text": "The 63% value is historical, not a competing current measurement."
        }
      ],
      "forbidden_conclusions": [
        {